{"payload":"eyJhcnRpZmFjdF9zdGF0dXMiOiJ0ZXN0LW9ubHkiLCJlbnRyeV9zZXRfZGlnZXN0Ijoic2hhMjU2Ojg3NzE2MzIzZjAwYTVkYjIzY2IxYmU1OTE0ZDFkYTM5ZDY3MWY3NTQ5M2U4Y2ZjNjk5NzA2NjRjYmI5M2QyMjUiLCJnZW5lcmF0ZWRfYXQiOiIyMDI2LTA4LTAzVDAwOjAwOjAwWiIsImtleV9zdGF0dXNlcyI6W3siY29tcHJvbWlzZV9pbmRpY2F0b3IiOmZhbHNlLCJlZmZlY3RpdmVfYXQiOiIyMDI2LTA4LTAzVDAwOjAwOjAwWiIsImVudHJ5X3R5cGUiOiJrZXktc3RhdHVzIiwia2V5X2lkIjoic2hhMjU2OjA2ZTNmZDhmZGEyOWJiNjBhYjU5NTU3ZGU2MWVkYjBhZWNkYjIzMTEzNGJlMzBlNzViNDU1ZjhlMWI3OTJmYTkiLCJyZWFzb25fY29kZSI6ImZpeHR1cmUta2V5LWFjdGl2ZSIsInJlcGxhY2VtZW50X2tleV9pZCI6bnVsbCwic3RhdHVzIjoiYWN0aXZlIiwic3RhdHVzX2VudHJ5X2RpZ2VzdCI6InNoYTI1Njo0NDc4YzdjNjZkODU1ODQ4NmEzNzRlOGY3YWFlNTAzN2M3ZTViY2IwNjNmNzJmNDdkY2QwMzZkNWY1ZDFjYzY3IiwidXNhZ2UiOiJyZWxlYXNlLXNpZ25pbmcifV0sInByZXZpb3VzX3N0YXR1c19zZXRfZGlnZXN0Ijoic2hhMjU2OmRhZmRjMWU2ZDk4N2Q3NTRlZmM0MzBiOTk1ZDY3MDZmN2U5OGI4OWYyZjUzN2YxZjcwMzEwMTA4ZjdlNDU4YmQiLCJyZWNvcmRfdHlwZSI6InB1YmxpYy1yZWxlYXNlLXN0YXR1cy1zZXQiLCJyZWxlYXNlX3N0YXR1c2VzIjpbeyJidW5kbGVfbWFuaWZlc3RfZGlnZXN0Ijoic2hhMjU2OmM3NjY1MzIzM2FhZGFlMzRmODk1MzQ5NTQ1ZDQxYjQ5OWEwZThmMzc0NzQ0MzY2NDJmMmNhZmFmNTE0NzNkNGMiLCJlZmZlY3RpdmVfYXQiOiIyMDI2LTA4LTAzVDAwOjAwOjAwWiIsImVudHJ5X3R5cGUiOiJyZWxlYXNlLXN0YXR1cyIsIm5vdGljZV9kaWdlc3QiOm51bGwsInJlYXNvbl9jb2RlIjoiZml4dHVyZS1yZWxlYXNlLXN1cGVyc2VkZWQiLCJyZWxlYXNlX2lkIjoicHJpdmF0ZS1tYXRjaC1hc3N1cmFuY2UtZml4dHVyZS1yZWxlYXNlLTAuMS4wIiwicmVwbGFjZW1lbnRfYnVuZGxlX2RpZ2VzdCI6InNoYTI1Njo5YTlhOWE5YTlhOWE5YTlhOWE5YTlhOWE5YTlhOWE5YTlhOWE5YTlhOWE5YTlhOWE5YTlhOWE5YTlhOWE5YTlhIiwicmVwbGFjZW1lbnRfcmVsZWFzZV9pZCI6InByaXZhdGUtbWF0Y2gtYXNzdXJhbmNlLWZpeHR1cmUtcmVsZWFzZS0wLjIuMCIsInN0YXRlIjoic3VwZXJzZWRlZCIsInN0YXR1c19lbnRyeV9kaWdlc3QiOiJzaGEyNTY6YjQxMjMyODA1OTFkNTU5NjE5ZjdlMzA5MmNlMWUzMzdiMmUwOGNlMWY2NDM3MjEwMTFhODE5YTQwMDU2ZmE5YyJ9XSwicmV2aXNpb24iOjIsInNjaGVtYV92ZXJzaW9uIjoiMC4xIiwic2lnbmluZ19rZXlfaWQiOiJzaGEyNTY6ZGViMmRlZDM5ZGMyNmZjZTBlNjA4NWI2ZmMzNGJmNmI1OTQxOTEzYmJmZTJlYTYxNDExM2NmZjllMDA0YzE3MCIsInN0YXR1c19zZXRfZGlnZXN0Ijoic2hhMjU2OmJjYjA0ODNkNjhhN2FkOTc1Zjc3ZjE1ODg2OWQwM2E3YjJkY2U4NjEyYTJkYjgzNzg5N2U4MDFjMGE4OTA1M2MiLCJzdGF0dXNfc2V0X2lkIjoiUE1BLVBVQkxJQy1SRUxFQVNFLVNUQVRVUy1GSVhUVVJFLVYwLTEiLCJ0cnVzdF9kb21haW5faWQiOiJpdGRvLXByaXZhdGUtbWF0Y2gtYXNzdXJhbmNlLWZpeHR1cmUtdjAuMSJ9","payloadType":"application/vnd.itdo.private-match.assurance-release-status-set.v0.1+json","signatures":[{"keyid":"sha256:deb2ded39dc26fce0e6085b6fc34bf6b5941913bbfe2ea614113cff9e004c170","sig":"OsjjEaKbZyRKee2M7PTG0Cauya6ym0GKZhp1+4DhoAqgVqVwKhDUeT9EmJJ4IwNwrdiQ34CbxC2VC/P+DrKbBw=="}],"signingProfile":{"algorithm":"ed25519-rfc8032","id":"private-match-public-release-signing","version":"0.1"}}