{"payload":"eyJhcnRpZmFjdF9zdGF0dXMiOiJ0ZXN0LW9ubHkiLCJlbnRyeV9zZXRfZGlnZXN0Ijoic2hhMjU2Ojc4MjM3NWEyYWM0NTRhMmNmMWJlOThmZjIxNzZmZjNiOGVmNjQ4NmI5ZjI1YmFkODJlYzJhOGYzNTA1YmI2ZDUiLCJnZW5lcmF0ZWRfYXQiOiIyMDI2LTA4LTAzVDAwOjAwOjAwWiIsImtleV9zdGF0dXNlcyI6W3siY29tcHJvbWlzZV9pbmRpY2F0b3IiOmZhbHNlLCJlZmZlY3RpdmVfYXQiOiIyMDI2LTA4LTAzVDAwOjAwOjAwWiIsImVudHJ5X3R5cGUiOiJrZXktc3RhdHVzIiwia2V5X2lkIjoic2hhMjU2OjA2ZTNmZDhmZGEyOWJiNjBhYjU5NTU3ZGU2MWVkYjBhZWNkYjIzMTEzNGJlMzBlNzViNDU1ZjhlMWI3OTJmYTkiLCJyZWFzb25fY29kZSI6ImZpeHR1cmUta2V5LWFjdGl2ZSIsInJlcGxhY2VtZW50X2tleV9pZCI6bnVsbCwic3RhdHVzIjoiYWN0aXZlIiwic3RhdHVzX2VudHJ5X2RpZ2VzdCI6InNoYTI1Njo0NDc4YzdjNjZkODU1ODQ4NmEzNzRlOGY3YWFlNTAzN2M3ZTViY2IwNjNmNzJmNDdkY2QwMzZkNWY1ZDFjYzY3IiwidXNhZ2UiOiJyZWxlYXNlLXNpZ25pbmcifV0sInByZXZpb3VzX3N0YXR1c19zZXRfZGlnZXN0Ijoic2hhMjU2OmRhZmRjMWU2ZDk4N2Q3NTRlZmM0MzBiOTk1ZDY3MDZmN2U5OGI4OWYyZjUzN2YxZjcwMzEwMTA4ZjdlNDU4YmQiLCJyZWNvcmRfdHlwZSI6InB1YmxpYy1yZWxlYXNlLXN0YXR1cy1zZXQiLCJyZWxlYXNlX3N0YXR1c2VzIjpbeyJidW5kbGVfbWFuaWZlc3RfZGlnZXN0Ijoic2hhMjU2OmM3NjY1MzIzM2FhZGFlMzRmODk1MzQ5NTQ1ZDQxYjQ5OWEwZThmMzc0NzQ0MzY2NDJmMmNhZmFmNTE0NzNkNGMiLCJlZmZlY3RpdmVfYXQiOiIyMDI2LTA4LTAzVDAwOjAwOjAwWiIsImVudHJ5X3R5cGUiOiJyZWxlYXNlLXN0YXR1cyIsIm5vdGljZV9kaWdlc3QiOm51bGwsInJlYXNvbl9jb2RlIjoiZml4dHVyZS1yZWxlYXNlLWV4cGlyZWQiLCJyZWxlYXNlX2lkIjoicHJpdmF0ZS1tYXRjaC1hc3N1cmFuY2UtZml4dHVyZS1yZWxlYXNlLTAuMS4wIiwicmVwbGFjZW1lbnRfYnVuZGxlX2RpZ2VzdCI6bnVsbCwicmVwbGFjZW1lbnRfcmVsZWFzZV9pZCI6bnVsbCwic3RhdGUiOiJleHBpcmVkIiwic3RhdHVzX2VudHJ5X2RpZ2VzdCI6InNoYTI1NjpjZWUzODlkNDMwYzlhMTJmMDUyYTFmZjg4OGI5NDhjMDBlYjQzMTBiMTBkYWQ3NTI4ZDJiMGUwNzA1NmZiZTU1In1dLCJyZXZpc2lvbiI6Miwic2NoZW1hX3ZlcnNpb24iOiIwLjEiLCJzaWduaW5nX2tleV9pZCI6InNoYTI1NjpkZWIyZGVkMzlkYzI2ZmNlMGU2MDg1YjZmYzM0YmY2YjU5NDE5MTNiYmZlMmVhNjE0MTEzY2ZmOWUwMDRjMTcwIiwic3RhdHVzX3NldF9kaWdlc3QiOiJzaGEyNTY6ZmEyODE4ZDJiZmM1M2FjZTQ2MzdkYTRiZWJjODQ0MzMwYTVhYjk1NDg4MzRkNzRjODMyMDZmY2M1M2FiYWIzZCIsInN0YXR1c19zZXRfaWQiOiJQTUEtUFVCTElDLVJFTEVBU0UtU1RBVFVTLUZJWFRVUkUtVjAtMSIsInRydXN0X2RvbWFpbl9pZCI6Iml0ZG8tcHJpdmF0ZS1tYXRjaC1hc3N1cmFuY2UtZml4dHVyZS12MC4xIn0=","payloadType":"application/vnd.itdo.private-match.assurance-release-status-set.v0.1+json","signatures":[{"keyid":"sha256:deb2ded39dc26fce0e6085b6fc34bf6b5941913bbfe2ea614113cff9e004c170","sig":"0HZCB1zbH3LB9DKBkq6f0GJYndSiBS9kRMg5Agr93jkyKY33lQhQ8UTyO+eIp0ciVVRi+NbuTNyp2mjKJXEwCw=="}],"signingProfile":{"algorithm":"ed25519-rfc8032","id":"private-match-public-release-signing","version":"0.1"}}