{"payload":"eyJhcnRpZmFjdF9zdGF0dXMiOiJ0ZXN0LW9ubHkiLCJlbnRyeV9zZXRfZGlnZXN0Ijoic2hhMjU2Ojk4OGFlZjI1NjcxZmJjMTk5NmE2ZjNjNTU5OTBiZTZiMzA2MjE4ZDgzZGYwYTAyNzg4ZGVmMzJkNDkyYThiNjkiLCJnZW5lcmF0ZWRfYXQiOiIyMDI2LTA4LTAxVDAwOjAwOjAwWiIsImtleV9zdGF0dXNlcyI6W3siY29tcHJvbWlzZV9pbmRpY2F0b3IiOmZhbHNlLCJlZmZlY3RpdmVfYXQiOiIyMDI2LTA4LTAxVDAwOjAwOjAwWiIsImVudHJ5X3R5cGUiOiJrZXktc3RhdHVzIiwia2V5X2lkIjoic2hhMjU2OjA2ZTNmZDhmZGEyOWJiNjBhYjU5NTU3ZGU2MWVkYjBhZWNkYjIzMTEzNGJlMzBlNzViNDU1ZjhlMWI3OTJmYTkiLCJyZWFzb25fY29kZSI6ImZpeHR1cmUta2V5LWFjdGl2ZSIsInJlcGxhY2VtZW50X2tleV9pZCI6bnVsbCwic3RhdHVzIjoiYWN0aXZlIiwic3RhdHVzX2VudHJ5X2RpZ2VzdCI6InNoYTI1NjpmZmI5MGNlYmUzZmU3ZDVmMTA5YWNjOWEzNWQxZTgxM2ZiZDJkMTRjMWRiZmI5Y2ZlMDExMTAzNzk3NWJmNWRmIiwidXNhZ2UiOiJyZWxlYXNlLXNpZ25pbmcifV0sInByZXZpb3VzX3N0YXR1c19zZXRfZGlnZXN0IjpudWxsLCJyZWNvcmRfdHlwZSI6InB1YmxpYy1yZWxlYXNlLXN0YXR1cy1zZXQiLCJyZWxlYXNlX3N0YXR1c2VzIjpbeyJidW5kbGVfbWFuaWZlc3RfZGlnZXN0Ijoic2hhMjU2OmM3NjY1MzIzM2FhZGFlMzRmODk1MzQ5NTQ1ZDQxYjQ5OWEwZThmMzc0NzQ0MzY2NDJmMmNhZmFmNTE0NzNkNGMiLCJlZmZlY3RpdmVfYXQiOiIyMDI2LTA4LTAxVDAwOjAwOjAwWiIsImVudHJ5X3R5cGUiOiJyZWxlYXNlLXN0YXR1cyIsIm5vdGljZV9kaWdlc3QiOm51bGwsInJlYXNvbl9jb2RlIjoiZml4dHVyZS1yZWxlYXNlLWFjdGl2ZSIsInJlbGVhc2VfaWQiOiJwcml2YXRlLW1hdGNoLWFzc3VyYW5jZS1maXh0dXJlLXJlbGVhc2UtMC4xLjAiLCJyZXBsYWNlbWVudF9idW5kbGVfZGlnZXN0IjpudWxsLCJyZXBsYWNlbWVudF9yZWxlYXNlX2lkIjpudWxsLCJzdGF0ZSI6ImFjdGl2ZSIsInN0YXR1c19lbnRyeV9kaWdlc3QiOiJzaGEyNTY6NzMyZjhiZmY1MzVkMDNmMWZlOTNkMGI0NGU1YTEwZjRiN2RkYjU5OThhNDg4ZjI5ODZhNGZmNjNhYWU0N2RmNCJ9XSwicmV2aXNpb24iOjEsInNjaGVtYV92ZXJzaW9uIjoiMC4xIiwic2lnbmluZ19rZXlfaWQiOiJzaGEyNTY6ZGViMmRlZDM5ZGMyNmZjZTBlNjA4NWI2ZmMzNGJmNmI1OTQxOTEzYmJmZTJlYTYxNDExM2NmZjllMDA0YzE3MCIsInN0YXR1c19zZXRfZGlnZXN0Ijoic2hhMjU2OmRhZmRjMWU2ZDk4N2Q3NTRlZmM0MzBiOTk1ZDY3MDZmN2U5OGI4OWYyZjUzN2YxZjcwMzEwMTA4ZjdlNDU4YmQiLCJzdGF0dXNfc2V0X2lkIjoiUE1BLVBVQkxJQy1SRUxFQVNFLVNUQVRVUy1GSVhUVVJFLVYwLTEiLCJ0cnVzdF9kb21haW5faWQiOiJpdGRvLXByaXZhdGUtbWF0Y2gtYXNzdXJhbmNlLWZpeHR1cmUtdjAuMSJ9","payloadType":"application/vnd.itdo.private-match.assurance-release-status-set.v0.1+json","signatures":[{"keyid":"sha256:deb2ded39dc26fce0e6085b6fc34bf6b5941913bbfe2ea614113cff9e004c170","sig":"k1W//rF+3dHm1IXR2SHgGV0PuStIuWTeZp4FCSOs7TDvs8FgAmlue/4OJV5s8JFxqoiz+SRNbv8986pWH+8GCA=="}],"signingProfile":{"algorithm":"ed25519-rfc8032","id":"private-match-public-release-signing","version":"0.1"}}