{"payload":"eyJhcnRpZmFjdF9zdGF0dXMiOiJ0ZXN0LW9ubHkiLCJlbnRyeV9zZXRfZGlnZXN0Ijoic2hhMjU2OjliOGI0MTIwMDFhZmI3MmU4MzRjOTVlNjg5OTc0NDAzYzYzZWVhNjM2MGIzYzBlOWI3Y2ZlNjJjNGMyOTVkZmYiLCJnZW5lcmF0ZWRfYXQiOiIyMDI2LTA4LTAzVDAwOjAwOjAwWiIsImtleV9zdGF0dXNlcyI6W3siY29tcHJvbWlzZV9pbmRpY2F0b3IiOmZhbHNlLCJlZmZlY3RpdmVfYXQiOiIyMDI2LTA4LTAzVDAwOjAwOjAwWiIsImVudHJ5X3R5cGUiOiJrZXktc3RhdHVzIiwia2V5X2lkIjoic2hhMjU2OjA2ZTNmZDhmZGEyOWJiNjBhYjU5NTU3ZGU2MWVkYjBhZWNkYjIzMTEzNGJlMzBlNzViNDU1ZjhlMWI3OTJmYTkiLCJyZWFzb25fY29kZSI6ImZpeHR1cmUta2V5LWFjdGl2ZSIsInJlcGxhY2VtZW50X2tleV9pZCI6bnVsbCwic3RhdHVzIjoiYWN0aXZlIiwic3RhdHVzX2VudHJ5X2RpZ2VzdCI6InNoYTI1Njo0NDc4YzdjNjZkODU1ODQ4NmEzNzRlOGY3YWFlNTAzN2M3ZTViY2IwNjNmNzJmNDdkY2QwMzZkNWY1ZDFjYzY3IiwidXNhZ2UiOiJyZWxlYXNlLXNpZ25pbmcifV0sInByZXZpb3VzX3N0YXR1c19zZXRfZGlnZXN0Ijoic2hhMjU2OmRhZmRjMWU2ZDk4N2Q3NTRlZmM0MzBiOTk1ZDY3MDZmN2U5OGI4OWYyZjUzN2YxZjcwMzEwMTA4ZjdlNDU4YmQiLCJyZWNvcmRfdHlwZSI6InB1YmxpYy1yZWxlYXNlLXN0YXR1cy1zZXQiLCJyZWxlYXNlX3N0YXR1c2VzIjpbeyJidW5kbGVfbWFuaWZlc3RfZGlnZXN0Ijoic2hhMjU2OmM3NjY1MzIzM2FhZGFlMzRmODk1MzQ5NTQ1ZDQxYjQ5OWEwZThmMzc0NzQ0MzY2NDJmMmNhZmFmNTE0NzNkNGMiLCJlZmZlY3RpdmVfYXQiOiIyMDI2LTA4LTAzVDAwOjAwOjAwWiIsImVudHJ5X3R5cGUiOiJyZWxlYXNlLXN0YXR1cyIsIm5vdGljZV9kaWdlc3QiOiJzaGEyNTY6OWI5YjliOWI5YjliOWI5YjliOWI5YjliOWI5YjliOWI5YjliOWI5YjliOWI5YjliOWI5YjliOWI5YjliOWI5YiIsInJlYXNvbl9jb2RlIjoiZml4dHVyZS1yZWxlYXNlLXdpdGhkcmF3biIsInJlbGVhc2VfaWQiOiJwcml2YXRlLW1hdGNoLWFzc3VyYW5jZS1maXh0dXJlLXJlbGVhc2UtMC4xLjAiLCJyZXBsYWNlbWVudF9idW5kbGVfZGlnZXN0IjpudWxsLCJyZXBsYWNlbWVudF9yZWxlYXNlX2lkIjpudWxsLCJzdGF0ZSI6IndpdGhkcmF3biIsInN0YXR1c19lbnRyeV9kaWdlc3QiOiJzaGEyNTY6MzMxOGNkMzUyNGVmOTEwMDFlNTYxNjIzZmE5NDg0MjdjNDI0YWEyZmM0NjBmYTM1NTYxNDAyM2UxNjUwZDM4NCJ9XSwicmV2aXNpb24iOjIsInNjaGVtYV92ZXJzaW9uIjoiMC4xIiwic2lnbmluZ19rZXlfaWQiOiJzaGEyNTY6ZGViMmRlZDM5ZGMyNmZjZTBlNjA4NWI2ZmMzNGJmNmI1OTQxOTEzYmJmZTJlYTYxNDExM2NmZjllMDA0YzE3MCIsInN0YXR1c19zZXRfZGlnZXN0Ijoic2hhMjU2OjMxYzRkZDAwYWY0MzgzNDJlODYzZTI1MmU4M2M4NDRkZDJlNjlhYjM3OTAxMzAyOWUyYjA4MjIwNDA5ODMwYzEiLCJzdGF0dXNfc2V0X2lkIjoiUE1BLVBVQkxJQy1SRUxFQVNFLVNUQVRVUy1GSVhUVVJFLVYwLTEiLCJ0cnVzdF9kb21haW5faWQiOiJpdGRvLXByaXZhdGUtbWF0Y2gtYXNzdXJhbmNlLWZpeHR1cmUtdjAuMSJ9","payloadType":"application/vnd.itdo.private-match.assurance-release-status-set.v0.1+json","signatures":[{"keyid":"sha256:deb2ded39dc26fce0e6085b6fc34bf6b5941913bbfe2ea614113cff9e004c170","sig":"daCmQDtLpNXpg592e7y2WQES5DImvS0pVBqfjRQbbMvpxiXigzjfmq+a3hEzp7Ypd53ZO9AzA8c8bduPAr2yAw=="}],"signingProfile":{"algorithm":"ed25519-rfc8032","id":"private-match-public-release-signing","version":"0.1"}}