{"payload":"eyJhcnRpZmFjdF9zdGF0dXMiOiJ0ZXN0LW9ubHkiLCJlbnRyeV9zZXRfZGlnZXN0Ijoic2hhMjU2OmY1YzJhYzNhMDk2MDVhZWQwYjYyY2QxNjRmYTllMjNkN2I3NzAyOWVlNDJkODM2NjcwYzgyMDZlOTk2MTZiYTIiLCJnZW5lcmF0ZWRfYXQiOiIyMDI2LTA4LTAxVDAwOjAwOjAwWiIsImtleV9zdGF0dXNlcyI6W3siY29tcHJvbWlzZV9pbmRpY2F0b3IiOmZhbHNlLCJlZmZlY3RpdmVfYXQiOiIyMDI2LTA4LTAxVDAwOjAwOjAwWiIsImVudHJ5X3R5cGUiOiJrZXktc3RhdHVzIiwia2V5X2lkIjoic2hhMjU2OjA2ZTNmZDhmZGEyOWJiNjBhYjU5NTU3ZGU2MWVkYjBhZWNkYjIzMTEzNGJlMzBlNzViNDU1ZjhlMWI3OTJmYTkiLCJyZWFzb25fY29kZSI6ImZpeHR1cmUta2V5LWFjdGl2ZSIsInJlcGxhY2VtZW50X2tleV9pZCI6bnVsbCwic3RhdHVzIjoiYWN0aXZlIiwic3RhdHVzX2VudHJ5X2RpZ2VzdCI6InNoYTI1NjpmZmI5MGNlYmUzZmU3ZDVmMTA5YWNjOWEzNWQxZTgxM2ZiZDJkMTRjMWRiZmI5Y2ZlMDExMTAzNzk3NWJmNWRmIiwidXNhZ2UiOiJyZWxlYXNlLXNpZ25pbmcifSx7ImNvbXByb21pc2VfaW5kaWNhdG9yIjpmYWxzZSwiZWZmZWN0aXZlX2F0IjoiMjAyNi0wOC0wMVQwMDowMDowMFoiLCJlbnRyeV90eXBlIjoia2V5LXN0YXR1cyIsImtleV9pZCI6InNoYTI1NjpkZWIyZGVkMzlkYzI2ZmNlMGU2MDg1YjZmYzM0YmY2YjU5NDE5MTNiYmZlMmVhNjE0MTEzY2ZmOWUwMDRjMTcwIiwicmVhc29uX2NvZGUiOiJmaXh0dXJlLXN0YXR1cy1hdXRob3JpdHktYWN0aXZlIiwicmVwbGFjZW1lbnRfa2V5X2lkIjpudWxsLCJzdGF0dXMiOiJhY3RpdmUiLCJzdGF0dXNfZW50cnlfZGlnZXN0Ijoic2hhMjU2OjkxNTRjZGE1Y2YzN2IxZjdmYmYzZWEyYzExMTkzM2IxNmI0NmE3ZTRlY2E2ZGYxNWI5ZGEzZTc0YjExOGY5NzgiLCJ1c2FnZSI6InJlbGVhc2Utc3RhdHVzLXNpZ25pbmcifV0sInByZXZpb3VzX3N0YXR1c19zZXRfZGlnZXN0IjpudWxsLCJyZWNvcmRfdHlwZSI6InB1YmxpYy1yZWxlYXNlLXN0YXR1cy1zZXQiLCJyZWxlYXNlX3N0YXR1c2VzIjpbeyJidW5kbGVfbWFuaWZlc3RfZGlnZXN0Ijoic2hhMjU2OjEwNDI1ZDIxZDUxODZiYzVhMGZmOWRhN2JkYzgxNmI5Zjg5MzRkN2I2YWIwZWNiOGNjZDA5ZTZmNThjYjI3ZmYiLCJlZmZlY3RpdmVfYXQiOiIyMDI2LTA4LTAxVDAwOjAwOjAwWiIsImVudHJ5X3R5cGUiOiJyZWxlYXNlLXN0YXR1cyIsIm5vdGljZV9kaWdlc3QiOm51bGwsInJlYXNvbl9jb2RlIjoiZml4dHVyZS1yZWxlYXNlLWFjdGl2ZSIsInJlbGVhc2VfaWQiOiJwcml2YXRlLW1hdGNoLWFzc3VyYW5jZS1maXh0dXJlLXJlbGVhc2UtMC4xLjAiLCJyZXBsYWNlbWVudF9idW5kbGVfZGlnZXN0IjpudWxsLCJyZXBsYWNlbWVudF9yZWxlYXNlX2lkIjpudWxsLCJzdGF0ZSI6ImFjdGl2ZSIsInN0YXR1c19lbnRyeV9kaWdlc3QiOiJzaGEyNTY6OTFmMDYzYzdhNmY4ZjllZWQzZGM2NDk5Y2M0ZGUwODZhN2Y0M2MyMGE2MGVjODEyN2RhNWQyYTRmYmRmOTUwMCJ9XSwicmV2aXNpb24iOjEsInNjaGVtYV92ZXJzaW9uIjoiMC4xIiwic2lnbmluZ19rZXlfaWQiOiJzaGEyNTY6ZGViMmRlZDM5ZGMyNmZjZTBlNjA4NWI2ZmMzNGJmNmI1OTQxOTEzYmJmZTJlYTYxNDExM2NmZjllMDA0YzE3MCIsInN0YXR1c19zZXRfZGlnZXN0Ijoic2hhMjU2OmYyZDRjYjdmZTE4ZDNiYjI3MDJjZTFkM2RhZjJmODQ5ZGExNGE5M2MxZjg1YjE2YjI2ZjQ0OTMwNDUyOGI2NGMiLCJzdGF0dXNfc2V0X2lkIjoiUE1BLVBVQkxJQy1SRUxFQVNFLVNUQVRVUy1GSVhUVVJFLVYwLTEiLCJ0cnVzdF9kb21haW5faWQiOiJpdGRvLXByaXZhdGUtbWF0Y2gtYXNzdXJhbmNlLWZpeHR1cmUtdjAuMSJ9","payloadType":"application/vnd.itdo.private-match.assurance-release-status-set.v0.1+json","signatures":[{"keyid":"sha256:deb2ded39dc26fce0e6085b6fc34bf6b5941913bbfe2ea614113cff9e004c170","sig":"ZH66Jaanj721ZLtOxkDb8hyda0t+Q80iOuNVstAhb63ss97yDolKENmc5Qs0hi2HGkMUpx2Fee6kzbyxYkL0Aw=="}],"signingProfile":{"algorithm":"ed25519-rfc8032","id":"private-match-public-release-signing","version":"0.1"}}