{"payload":"eyJhcnRpZmFjdF9zdGF0dXMiOiJ0ZXN0LW9ubHkiLCJlbnRyeV9zZXRfZGlnZXN0Ijoic2hhMjU2OjY1MTZmOTU1ODZlZWU4N2M3OTRiOTg2MmUzZDc5NjJiNjU5OGIxZTE5ZWU4YTEzMWU0ZjJlYmM0YzViZjUyNDgiLCJnZW5lcmF0ZWRfYXQiOiIyMDI2LTA4LTAzVDAwOjAwOjAwWiIsImtleV9zdGF0dXNlcyI6W3siY29tcHJvbWlzZV9pbmRpY2F0b3IiOnRydWUsImVmZmVjdGl2ZV9hdCI6IjIwMjYtMDgtMDNUMDA6MDA6MDBaIiwiZW50cnlfdHlwZSI6ImtleS1zdGF0dXMiLCJrZXlfaWQiOiJzaGEyNTY6MDZlM2ZkOGZkYTI5YmI2MGFiNTk1NTdkZTYxZWRiMGFlY2RiMjMxMTM0YmUzMGU3NWI0NTVmOGUxYjc5MmZhOSIsInJlYXNvbl9jb2RlIjoiZml4dHVyZS1rZXktY29tcHJvbWlzZWQiLCJyZXBsYWNlbWVudF9rZXlfaWQiOm51bGwsInN0YXR1cyI6InJldm9rZWQiLCJzdGF0dXNfZW50cnlfZGlnZXN0Ijoic2hhMjU2OmJjNDc2NmJkMjcyM2ZiYmYwNjMxZjZkOWY1NWZmMTMxZDViZTU4OGMxMjQ4YTIwODc4YmY3Yzc0YzJmMmEzYmYiLCJ1c2FnZSI6InJlbGVhc2Utc2lnbmluZyJ9XSwicHJldmlvdXNfc3RhdHVzX3NldF9kaWdlc3QiOiJzaGEyNTY6ZGFmZGMxZTZkOTg3ZDc1NGVmYzQzMGI5OTVkNjcwNmY3ZTk4Yjg5ZjJmNTM3ZjFmNzAzMTAxMDhmN2U0NThiZCIsInJlY29yZF90eXBlIjoicHVibGljLXJlbGVhc2Utc3RhdHVzLXNldCIsInJlbGVhc2Vfc3RhdHVzZXMiOlt7ImJ1bmRsZV9tYW5pZmVzdF9kaWdlc3QiOiJzaGEyNTY6Yzc2NjUzMjMzYWFkYWUzNGY4OTUzNDk1NDVkNDFiNDk5YTBlOGYzNzQ3NDQzNjY0MmYyY2FmYWY1MTQ3M2Q0YyIsImVmZmVjdGl2ZV9hdCI6IjIwMjYtMDgtMDNUMDA6MDA6MDBaIiwiZW50cnlfdHlwZSI6InJlbGVhc2Utc3RhdHVzIiwibm90aWNlX2RpZ2VzdCI6bnVsbCwicmVhc29uX2NvZGUiOiJmaXh0dXJlLXJlbGVhc2UtYWN0aXZlIiwicmVsZWFzZV9pZCI6InByaXZhdGUtbWF0Y2gtYXNzdXJhbmNlLWZpeHR1cmUtcmVsZWFzZS0wLjEuMCIsInJlcGxhY2VtZW50X2J1bmRsZV9kaWdlc3QiOm51bGwsInJlcGxhY2VtZW50X3JlbGVhc2VfaWQiOm51bGwsInN0YXRlIjoiYWN0aXZlIiwic3RhdHVzX2VudHJ5X2RpZ2VzdCI6InNoYTI1Njo3YTUwMTYyYTVkMzBjNDdmZWQzYTAxNzI0MTM0MjFmOWFkMDVkZTE3NjY2OTM4NjdjYjJhMDY0MGJlZjg3NTg2In1dLCJyZXZpc2lvbiI6Miwic2NoZW1hX3ZlcnNpb24iOiIwLjEiLCJzaWduaW5nX2tleV9pZCI6InNoYTI1NjpkZWIyZGVkMzlkYzI2ZmNlMGU2MDg1YjZmYzM0YmY2YjU5NDE5MTNiYmZlMmVhNjE0MTEzY2ZmOWUwMDRjMTcwIiwic3RhdHVzX3NldF9kaWdlc3QiOiJzaGEyNTY6NGUzNGMzOTllMDQ1ZGVkZWE5ZTcwNjg2YWI2ZjU2YjEyZjMxYWQ0YmVhODBiNTM2NDVmOWQ3OGQzMDFjM2E3YiIsInN0YXR1c19zZXRfaWQiOiJQTUEtUFVCTElDLVJFTEVBU0UtU1RBVFVTLUZJWFRVUkUtVjAtMSIsInRydXN0X2RvbWFpbl9pZCI6Iml0ZG8tcHJpdmF0ZS1tYXRjaC1hc3N1cmFuY2UtZml4dHVyZS12MC4xIn0=","payloadType":"application/vnd.itdo.private-match.assurance-release-status-set.v0.1+json","signatures":[{"keyid":"sha256:deb2ded39dc26fce0e6085b6fc34bf6b5941913bbfe2ea614113cff9e004c170","sig":"eevX3DGPge4UiM3XzR0qYibBMQ7cRy0otk7t98z9LD8m9Yix/YJMsKpu3uDkYi8QK1lRSm7SJxks+uPs/b8SBQ=="}],"signingProfile":{"algorithm":"ed25519-rfc8032","id":"private-match-public-release-signing","version":"0.1"}}