{"payload":"eyJhcnRpZmFjdF9zdGF0dXMiOiJ0ZXN0LW9ubHkiLCJlbnRyeV9zZXRfZGlnZXN0Ijoic2hhMjU2OjIyMDI2ZjlhODA3YjhiM2E4NDI3YWNlYjY4OTMwNDhkNDFkN2NiYjAyZGQwY2U1MDYyYjFlNmNhODViMjhlMjUiLCJnZW5lcmF0ZWRfYXQiOiIyMDI2LTA4LTAzVDAwOjAwOjAwWiIsImtleV9zdGF0dXNlcyI6W3siY29tcHJvbWlzZV9pbmRpY2F0b3IiOmZhbHNlLCJlZmZlY3RpdmVfYXQiOiIyMDI2LTA4LTAzVDAwOjAwOjAwWiIsImVudHJ5X3R5cGUiOiJrZXktc3RhdHVzIiwia2V5X2lkIjoic2hhMjU2OjA2ZTNmZDhmZGEyOWJiNjBhYjU5NTU3ZGU2MWVkYjBhZWNkYjIzMTEzNGJlMzBlNzViNDU1ZjhlMWI3OTJmYTkiLCJyZWFzb25fY29kZSI6ImZpeHR1cmUta2V5LWFjdGl2ZSIsInJlcGxhY2VtZW50X2tleV9pZCI6bnVsbCwic3RhdHVzIjoiYWN0aXZlIiwic3RhdHVzX2VudHJ5X2RpZ2VzdCI6InNoYTI1Njo0NDc4YzdjNjZkODU1ODQ4NmEzNzRlOGY3YWFlNTAzN2M3ZTViY2IwNjNmNzJmNDdkY2QwMzZkNWY1ZDFjYzY3IiwidXNhZ2UiOiJyZWxlYXNlLXNpZ25pbmcifV0sInByZXZpb3VzX3N0YXR1c19zZXRfZGlnZXN0Ijoic2hhMjU2OmRhZmRjMWU2ZDk4N2Q3NTRlZmM0MzBiOTk1ZDY3MDZmN2U5OGI4OWYyZjUzN2YxZjcwMzEwMTA4ZjdlNDU4YmQiLCJyZWNvcmRfdHlwZSI6InB1YmxpYy1yZWxlYXNlLXN0YXR1cy1zZXQiLCJyZWxlYXNlX3N0YXR1c2VzIjpbeyJidW5kbGVfbWFuaWZlc3RfZGlnZXN0Ijoic2hhMjU2OmM3NjY1MzIzM2FhZGFlMzRmODk1MzQ5NTQ1ZDQxYjQ5OWEwZThmMzc0NzQ0MzY2NDJmMmNhZmFmNTE0NzNkNGMiLCJlZmZlY3RpdmVfYXQiOiIyMDI2LTA4LTAzVDAwOjAwOjAwWiIsImVudHJ5X3R5cGUiOiJyZWxlYXNlLXN0YXR1cyIsIm5vdGljZV9kaWdlc3QiOm51bGwsInJlYXNvbl9jb2RlIjoiZml4dHVyZS1yZWxlYXNlLWNvcnJlY3RlZCIsInJlbGVhc2VfaWQiOiJwcml2YXRlLW1hdGNoLWFzc3VyYW5jZS1maXh0dXJlLXJlbGVhc2UtMC4xLjAiLCJyZXBsYWNlbWVudF9idW5kbGVfZGlnZXN0Ijoic2hhMjU2OjlhOWE5YTlhOWE5YTlhOWE5YTlhOWE5YTlhOWE5YTlhOWE5YTlhOWE5YTlhOWE5YTlhOWE5YTlhOWE5YTlhOWEiLCJyZXBsYWNlbWVudF9yZWxlYXNlX2lkIjoicHJpdmF0ZS1tYXRjaC1hc3N1cmFuY2UtZml4dHVyZS1yZWxlYXNlLTAuMi4wIiwic3RhdGUiOiJjb3JyZWN0ZWQiLCJzdGF0dXNfZW50cnlfZGlnZXN0Ijoic2hhMjU2OmI4ZjcyOGZmMTc3YzEyZWI1YzM2YzcyNTFkMWNmNTAwMjRiNzI5ZTIxZWFmZmZjODZmZmFkZTE2N2FhMmQxN2EifV0sInJldmlzaW9uIjoyLCJzY2hlbWFfdmVyc2lvbiI6IjAuMSIsInNpZ25pbmdfa2V5X2lkIjoic2hhMjU2OmRlYjJkZWQzOWRjMjZmY2UwZTYwODViNmZjMzRiZjZiNTk0MTkxM2JiZmUyZWE2MTQxMTNjZmY5ZTAwNGMxNzAiLCJzdGF0dXNfc2V0X2RpZ2VzdCI6InNoYTI1Njo4MmNiZWMyNDJjMzBiY2RlMTQ0OTJkMWIwMzYwMDc3YWIxMDYxODhjYjdiNjI1YjdmNGM4MjU5Yjg1Y2YzNTg1Iiwic3RhdHVzX3NldF9pZCI6IlBNQS1QVUJMSUMtUkVMRUFTRS1TVEFUVVMtRklYVFVSRS1WMC0xIiwidHJ1c3RfZG9tYWluX2lkIjoiaXRkby1wcml2YXRlLW1hdGNoLWFzc3VyYW5jZS1maXh0dXJlLXYwLjEifQ==","payloadType":"application/vnd.itdo.private-match.assurance-release-status-set.v0.1+json","signatures":[{"keyid":"sha256:deb2ded39dc26fce0e6085b6fc34bf6b5941913bbfe2ea614113cff9e004c170","sig":"b+cLFIwAkbIYyIepFayiOQ1yrFeMcJwm7ft4Vn/rANQqRxOmghWx++jt3PfkABHw1MZFY6XIylhawB7pf1xXAw=="}],"signingProfile":{"algorithm":"ed25519-rfc8032","id":"private-match-public-release-signing","version":"0.1"}}